{
  "$schema": "workshop.schema.json",
  "schemaVersion": 1,
  "configured": false,
  "workshopName": "Microsoft Fabric Workshop",
  "workspace": {
    "namePattern": "^.+$",
    "namePatternDescription": "Enter the exact assigned Fabric workspace name.",
    "protectedWorkspaces": []
  },
  "dataHandlingRules": [
    "Use only synthetic, public, aggregate, or explicitly approved data.",
    "Do not place credentials, tokens, connection strings, or sensitive data in Copilot prompts, terminal logs, or repository files."
  ],
  "additionalInstructions": [
    "Inspect and explain an item before proposing a change.",
    "Make the smallest reviewed change and validate it in Fabric."
  ]
}
